{
  "benchmark_name": "GSM8K",
  "paper_id": "2110.14168v2",
  "year": 2021,
  "benchmark_type": "single_dataset",
  "benchmark_type_evidence": "we introduce GSM8K, a dataset of 8.5K high quality linguistically diverse grade school math word problems",
  "total_languages_claimed": 1,
  "total_datasets": 1,
  "dataset_names": ["GSM8K"],
  "task_categories": ["mathematical_reasoning"],
  "brief_description": "GSM8K is a dataset of 8.5K high-quality grade school math word problems in English with natural language solutions, requiring 2-8 step reasoning using basic arithmetic operations. It was designed to diagnose multi-step mathematical reasoning failures in large language models."
}
