{
  "benchmark_name": "TriviaQA",
  "paper_id": "P17-1147",
  "year": 2017,
  "benchmark_type": "single_dataset",
  "benchmark_type_evidence": "We present TriviaQA, a challenging reading comprehension dataset containing over 650K question-answer-evidence triples.",
  "total_languages_claimed": 1,
  "total_datasets": 1,
  "dataset_names": [
    "TriviaQA"
  ],
  "task_categories": [
    "Reading Comprehension",
    "Question Answering"
  ],
  "brief_description": "TriviaQA is a large-scale reading comprehension dataset containing over 650K question-answer-evidence triples, with 95K question-answer pairs authored by trivia enthusiasts and independently gathered evidence documents from Wikipedia and the Web. It tests complex compositional questions, lexical/syntactic variability, and multi-sentence reasoning."
}
