{
  "benchmark_name": "AfroBench",
  "paper_id": "2025.findings-acl.976",
  "year": 2025,
  "benchmark_type": "mixed",
  "benchmark_type_evidence": "we introduce AFROBENCH—a multi-task benchmark for evaluating the performance of LLMs across 64 African languages, 15 tasks and 22 datasets... Finally, we created a new evaluation dataset, AFRIADR, a dataset for restoring diacritic marks and tonal accents in African language texts.",
  "total_languages_claimed": 64,
  "total_datasets": 22,
  "dataset_names": [
    "MasakhaPOS",
    "MasakhaNER-X",
    "SIB-200",
    "MasakhaNEWS",
    "AfriSenti",
    "NollySenti",
    "Injongo-Intent",
    "AfriHate",
    "AfriXNLI",
    "AfriQA",
    "Belebele",
    "NaijaRC",
    "Uhura-Arc-Easy",
    "AfriMMLU",
    "OpenAI-MMMLU",
    "AfriMGSM",
    "FLORES-200",
    "MAFAND",
    "NTREX-128",
    "SALT",
    "XLSum",
    "AfriADR"
  ],
  "task_categories": [
    "Sentiment Analysis",
    "Topic Classification",
    "Intent Classification",
    "Hate Speech Detection",
    "Natural Language Inference",
    "Named Entity Recognition",
    "Part-of-Speech Tagging",
    "Mathematical Reasoning",
    "Cross-Lingual Question Answering",
    "Reading Comprehension",
    "Knowledge QA",
    "Machine Translation",
    "Summarization",
    "Diacritics Restoration"
  ],
  "brief_description": "AfroBench is a comprehensive multi-task benchmark for evaluating LLM performance across 64 African languages, comprising 15 NLP tasks and 22 datasets spanning NLU, text generation, QA, and reasoning. It aggregates existing African language evaluation datasets and introduces one new dataset (AfriADR) for diacritics restoration."
}
